{
  "schema": "gluerun.orchestration.gate-result.v0",
  "node": "plan-revision-loop",
  "status": "passed",
  "authoritative": true,
  "evidenceClass": "deterministic-proof",
  "evidence": [
    {
      "kind": "command-log",
      "ref": "plan-revision-loop-gate",
      "description": "node exit-gate evidence run at the integrated head",
      "command": "bash tests/run.sh",
      "exitCode": 0,
      "logRef": "docs/orchestration/gates/logs/plan-revision-loop-gate.log",
      "sha256": "e76d01f8fa437e5c563c50c5e98e72b99f01c2807603319b75db1a6c9d4d4b53",
      "headSha": "dbf32f615b2dde91cc4db5df4ae31e773e528857"
    }
  ],
  "decidedBy": "operator:tools/promote-gate.sh",
  "rationale": "stage-file exit gate verified for plan-revision-loop; evidence command exited 0 at head dbf32f615b2d",
  "recordedAt": "2026-07-11T11:10:15Z"
}
