{
  "schema": "gluerun.orchestration.gate-result.v0",
  "node": "metrics-extract",
  "status": "passed",
  "authoritative": true,
  "evidenceClass": "deterministic-proof",
  "evidence": [
    {
      "kind": "command-log",
      "ref": "metrics-extract-gate",
      "description": "node exit-gate evidence run at the integrated head",
      "command": "bash tests/run.sh",
      "exitCode": 0,
      "logRef": "docs/orchestration/gates/logs/metrics-extract-gate.log",
      "sha256": "f57200c3832882eebc44a495a12f23d38ce3cefa1db9b60642e38a551d2a7953",
      "headSha": "5193434e14da1b56204433d700f991fa3daa1709"
    }
  ],
  "decidedBy": "operator:tools/promote-gate.sh",
  "rationale": "stage-file exit gate verified for metrics-extract; evidence command exited 0 at head 5193434e14da",
  "recordedAt": "2026-07-11T00:30:52Z"
}
