{
  "schema": "gluerun.orchestration.gate-result.v0",
  "node": "planner-session-meta",
  "status": "passed",
  "authoritative": true,
  "evidenceClass": "deterministic-proof",
  "evidence": [
    {
      "kind": "command-log",
      "ref": "planner-session-meta-gate",
      "description": "node exit-gate evidence run at the integrated head",
      "command": "bash tests/run.sh",
      "exitCode": 0,
      "logRef": "docs/orchestration/gates/logs/planner-session-meta-gate.log",
      "sha256": "807fc2793f369603a1f62c4c56f49c777cdd6cfcb211a0cb13bae1f2cf4864d5",
      "headSha": "3b5c7d4633152b4eb59ca7d7a66e24bf3f213b8f"
    }
  ],
  "decidedBy": "operator:tools/promote-gate.sh",
  "rationale": "stage-file exit gate verified for planner-session-meta; evidence command exited 0 at head 3b5c7d463315",
  "recordedAt": "2026-07-11T02:25:41Z"
}
