{
  "schema": "gluerun.orchestration.gate-result.v0",
  "node": "ctx-loader",
  "status": "passed",
  "authoritative": true,
  "evidenceClass": "deterministic-proof",
  "evidence": [
    {
      "kind": "command-log",
      "ref": "ctx-loader-gate",
      "description": "node exit-gate evidence run at the integrated head",
      "command": "bash tests/run.sh",
      "exitCode": 0,
      "logRef": "docs/orchestration/gates/logs/ctx-loader-gate.log",
      "sha256": "853541b04031e27bcf71f4a8e4beb2dda1f898541923b6ab6dbb127d1036315e",
      "headSha": "f4fe5f2120505653801e9ae1c71e9e6c57f20f50"
    }
  ],
  "decidedBy": "operator:tools/promote-gate.sh",
  "rationale": "stage-file exit gate verified for ctx-loader; evidence command exited 0 at head f4fe5f212050",
  "recordedAt": "2026-07-10T23:09:47Z"
}
