{
  "schema": "gluerun.orchestration.gate-result.v0",
  "node": "critic-carryover",
  "status": "passed",
  "authoritative": true,
  "evidenceClass": "deterministic-proof",
  "evidence": [
    {
      "kind": "command-log",
      "ref": "critic-carryover-gate",
      "description": "node exit-gate evidence run at the integrated head",
      "command": "bash tests/run.sh",
      "exitCode": 0,
      "logRef": "docs/orchestration/gates/logs/critic-carryover-gate.log",
      "sha256": "7023b0efbdaebc909d5908dea222703cbccb0b75dd79e7ef3256a0d73a8c63e5",
      "headSha": "0a9aa46f00e7dad07964ae9f612f8b5af891e4bb"
    }
  ],
  "decidedBy": "operator:tools/promote-gate.sh",
  "rationale": "stage-file exit gate verified for critic-carryover; evidence command exited 0 at head 0a9aa46f00e7",
  "recordedAt": "2026-07-11T15:57:27Z"
}
