{
  "schema": "gluerun.orchestration.gate-result.v0",
  "node": "routing-module",
  "status": "passed",
  "authoritative": true,
  "evidenceClass": "deterministic-proof",
  "evidence": [
    {
      "kind": "command-log",
      "ref": "routing-module-gate",
      "description": "node exit-gate evidence run at the integrated head",
      "command": "bash tests/run.sh",
      "exitCode": 0,
      "logRef": "docs/orchestration/gates/logs/routing-module-gate.log",
      "sha256": "648e782783e5a1e2bce8692befe8cd15b0b161bff222d56fc9e524d5a7ce6785",
      "headSha": "88f6269c7e503ba60c8a772301f2c896f29282b1"
    }
  ],
  "decidedBy": "operator:tools/promote-gate.sh",
  "rationale": "stage-file exit gate verified for routing-module; evidence command exited 0 at head 88f6269c7e50",
  "recordedAt": "2026-07-12T03:09:47Z"
}
