{
  "schema": "gluerun.orchestration.gate-result.v0",
  "node": "critique-import-gate",
  "status": "passed",
  "authoritative": true,
  "evidenceClass": "deterministic-proof",
  "evidence": [
    {
      "kind": "command-log",
      "ref": "critique-import-gate-gate",
      "description": "node exit-gate evidence run at the integrated head",
      "command": "bash tests/run.sh",
      "exitCode": 0,
      "logRef": "docs/orchestration/gates/logs/critique-import-gate-gate.log",
      "sha256": "f05faa08c1007393cfdd70bed6c37a2714549d9727176247361975938592b22f",
      "headSha": "3aa881d8a4135b8244c20dc8159de92f6df0e18f"
    }
  ],
  "decidedBy": "operator:tools/promote-gate.sh",
  "rationale": "stage-file exit gate verified for critique-import-gate; evidence command exited 0 at head 3aa881d8a413",
  "recordedAt": "2026-07-11T07:10:39Z"
}
